,name,status,certainty,single_cluster,max_ops_log,h100_equivalents,chip_type_primary,chip_quantity_primary,country,owner,first_operational_date,note,sector,power_capacity_mw,hardware_cost,location,users,hardware_note,quote,first_operational_date_note,certainty_note,energy_efficiency_log,builds_upon,superseded_by,possible_duplicate,possible_duplicate_of,chip_type_secondary,chip_quantity_secondary,total_number_of_ai_chips,rank_when_first_operational,16bit_ops_log,max_ops,8bit_ops,16bit_ops,32bit_ops,calculated_power_capacity_mw,reported_power_capacity_mw,energy_efficiency,calculated_cost,reported_cost,reported_cost_inflation_adjusted,cost_quote,decommissioned_date_if_applicable,largest_existing_cluster_when_first_operational,percent_of_largest_cluster_when_first_operational,primary_tdp_w,primary_vram_gb,secondary_tdp_w,secondary_vram_gb
498,Petrobras Atlas,Existing,Confirmed,Yes,17.133538908370216,68.72157655482691,NVIDIA V100,1088.0,Brazil,Petrobras,2020-06-01,,Public/Private,0.9789,20775184.635092027,"Rio de Janeiro, Brazil",Petrobras,V100,Calculated from Top500,2020-06-01,,11.142800579862678,,,,,,,1088.0,31.0,17.133538908370216,1.36e+17,,1.36e+17,17048960000000000,0.7128576,0.9789,138931453672.48953,20775184.635092027,,,,,Oak Ridge NL Summit,0.0393518518518519,300.0,16.0,0.0,0.0
499,Japan Atomic Energy Agency and Quantum and Radiological Science and Technology HPE SGI8600,Existing,Confirmed,Yes,17.133538908370216,68.72157655482691,NVIDIA Tesla V100 SXM2,1088.0,Japan,Japan Atomic Energy Agency,2020-11-01,,Public,0.7128576,22615099.765310995,Japan,"Japan Atomic Energy Agency,National Institutes for Quantum and Radiological Science and Technology",V100,Calculated from Top500,2020-11-01,,11.280536124255692,,,,,,,1088.0,41.0,17.133538908370216,1.36e+17,,1.36e+17,17048960000000000,0.7128576,,190781440781.4408,22615099.765310995,,,,,Oak Ridge NL Summit,0.0393518518518519,300.0,16.0,0.0,0.0
500,Jean Zay Supercomputer Phase 1,Existing,Confirmed,Yes,17.115610511674298,65.94239515003603,NVIDIA Tesla V100 SXM2 32 GB,1044.0,France,GENCI,2019-06-01,,Public,0.69542928,30548105.98278985,"Campus universitaire d'Orsay, Batiment 506, Rue John Von Neumann, 91403 Orsay, France",Researchers in academia and industry,V100,"the system encompasses 1,528 Intel next-generation Xeon nodes and 261 GPU nodes, each with four Nvidia Tesla V100 (32GB) GPUs, 1,044 in all.",2019-06-01,,11.27335753962857,,Jean Zay Supercomputer Phase 2,,,,,1044.0,18.0,17.115610511674298,1.305e+17,,1.305e+17,16359480000000000,0.69542928,,187653876178.4664,22443812.56149425,27916750.0,30548105.98278985,approximately €25 million for the first partition of the Jean-Zay machine,,Oak Ridge NL Summit,0.0377604166666667,300.0,32.0,0.0,0.0
501,Preferred Networks MN-2,Existing,Confirmed,Yes,17.107209969647865,64.67913087513097,NVIDIA V100,1024.0,Japan,Preferred Networks Inc,2019-07-30,,Private,0.68210688,20153662.293333333,Japan,Preferred Networks,V100,"GPUs: 1,024",2019-07-30,,11.27335753962857,,,,,,,1024.0,21.0,17.107209969647865,1.28e+17,,1.28e+17,16046080000000000,0.68210688,,187653876178.4664,20153662.293333333,,,,,Oak Ridge NL Summit,0.0370370370370369,300.0,16.0,0.0,0.0
502,Paper on DALL-E,Existing,Confirmed,Yes,17.107209969647865,64.67913087513097,NVIDIA V100,1024.0,,OpenAI,2021-02-24,,Private,0.65974272,19366409.86,,OpenAI,V100,"We trained the model using 1024, 16 GB NVIDIA V100 GPUs",2021-02-24,,11.287835362997193,,,True,Azure OpenAI GPT-3 Cluster,,,1024.0,50.0,17.107209969647865,1.28e+17,,1.28e+17,16046080000000000,0.65974272,,194015024523.4991,19366409.86,,,,,Oak Ridge NL Summit,0.0370370370370369,300.0,16.0,0.0,0.0
503,Paper on RoBERTa,Existing,Confirmed,Yes,17.107209969647865,64.67913087513097,NVIDIA Tesla V100 DGXS 32 GB,1024.0,United States of America,Meta AI,2019-07-26,,Private,0.5684224,31539757.12555236,,,,"We pretrain our model using
1024 V100 GPUs for approximately one day",2019-07-26,,11.352538785676195,,,True,Meta 2017 V100 Cluster,,,1024.0,21.0,17.107209969647865,1.28e+17,,1.28e+17,16046080000000000,0.5684224,,225184651414.1596,31539757.12555236,,,,,Oak Ridge NL Summit,0.0370370370370369,300.0,32.0,0.0,0.0
504,Paper on Meena,Existing,Confirmed,Yes,17.10020506807921,63.644264781129166,Google TPU v3,1024.0,,Google,2020-01-27,,Private,1.0063872,9859735.664835958,,,TPU v3,"""We trained our best model for 30 days on a TPUv3 Pod (2,048 TPU cores)""",2020-01-27,,11.097439963631354,,,True,Google TPUv3 POD Generic,,,1024.0,29.0,17.10020506807921,1.25952e+17,,1.25952e+17,,1.0063872,,125152625152.62514,9859735.664835958,,,,,Oak Ridge NL Summit,0.0364444444444445,200.0,32.0,0.0,0.0
505,Paper on LaMDA,Existing,Confirmed,Yes,17.10020506807921,63.644264781129166,Google TPU v3,1024.0,,Google,2022-01-20,,Private,0.98122752,9719635.89111035,,Google,TPU v3,"""We pre-trained LaMDA on 1024 TPU-v3 chips""",2022-01-20,,11.108435347932817,,,True,Google MLPerf 0.7 Submission,,,1024.0,110.0,17.10020506807921,1.25952e+17,,1.25952e+17,,0.98122752,,128361666823.20528,9719635.89111035,,,,,DeepSeek Fire-Flyer 2,0.0201846153846154,200.0,32.0,0.0,0.0
506,Paper on GShard,Existing,Confirmed,Yes,17.10020506807921,63.644264781129166,Google TPU v3,1024.0,,Google,2020-10-30,,Private,1.0063872,9765095.968227586,,Google,TPU v3,,2020-10-30,,11.097439963631354,,,True,Google MLPerf 0.7 Submission,,,1024.0,44.0,17.10020506807921,1.25952e+17,,1.25952e+17,,1.0063872,,125152625152.62514,9765095.968227586,,,,,Oak Ridge NL Summit,0.0364444444444445,200.0,32.0,0.0,0.0
507,Paper on Noisy Student,Existing,Confirmed,Yes,17.10020506807921,63.644264781129166,Google TPU v3,1024.0,,Google,2019-11-11,,Private,1.02316032,10018621.288799291,,Google,TPU v3,,2019-11-11,,11.090261379004229,,,True,Google TPUv3 POD Generic,,,1024.0,26.0,17.10020506807921,1.25952e+17,,1.25952e+17,,1.02316032,,123100942773.07391,10018621.288799291,,,,,Oak Ridge NL Summit,0.0364444444444445,200.0,32.0,0.0,0.0
508,Paper on Pseudo Labels,Existing,Confirmed,Yes,17.10020506807921,63.644264781129166,Google TPU v3,1024.0,,Google,2020-03-23,,Private,1.0063872,9859735.664835958,,Google,TPU v3,"""Specifically, our training process runs on a cluster of 2,048
TPUv3 cores.""",2020-03-23,,11.097439963631354,,,True,Google TPUv3 POD Generic,,,1024.0,30.0,17.10020506807921,1.25952e+17,,1.25952e+17,,1.0063872,,125152625152.62514,9859735.664835958,,,,,Oak Ridge NL Summit,0.0364444444444445,200.0,32.0,0.0,0.0
509,Google TPUv3 POD Generic,Existing,Confirmed,Yes,17.10020506807921,63.644264781129166,Google TPU v3,1024.0,,Google,2019-05-07,"Refers to the general commercially available pod, not to a specific cluster using the pod",Private,1.02316032,10154990.907067887,,Google,TPU v3,A TPU v3 Pod is composed of 1024 chips interconnected with high-speed links,2019-05-07,,11.090261379004229,,,,,,,1024.0,18.0,17.10020506807921,1.25952e+17,,1.25952e+17,,1.02316032,,123100942773.07391,10154990.907067887,,,,,Oak Ridge NL Summit,0.0364444444444445,200.0,32.0,0.0,0.0
510,Paper on Switch transformer,Existing,Likely,Yes,17.10020506807921,63.644264781129166,Google TPU v3,1024.0,,Google,2021-01-11,The TPU count is from the expert parallelism (1 expert per core) with 2048 experts and 2 tensor cores per TPU v3.,Private,0.98961408,9756582.37104517,,Google,TPU v3,,2021-01-11,,11.104739202372851,,,True,Google MLPerf 0.7 Submission,,,1024.0,50.0,17.10020506807921,1.25952e+17,,1.25952e+17,,0.98961408,,127273856087.41542,9756582.37104517,,,,,Oak Ridge NL Summit,0.0364444444444445,200.0,32.0,0.0,0.0
511,Texas A&M Grace,Existing,Confirmed,Yes,17.096214585346402,63.06215260325272,NVIDIA A100,200.0,United States of America,Texas A&M,2021-11-01,,Public,0.171808,6828281.021343445,"College Station, Texas",Academia,A100,Calculated from Top500,2021-11-01,,11.560141207399278,,,,,,,200.0,108.0,16.79518458968242,1.248e+17,1.248e+17,6.24e+16,31200000000000000,0.171808,,363196125907.9903,6828281.021343445,,,,,DeepSeek Fire-Flyer 2,0.02,400.0,80.0,0.0,0.0
512,SiDi IARA,Existing,Confirmed,Yes,17.096214585346402,63.06215260325272,NVIDIA A100,200.0,Brazil,SiDi,2021-06-01,,Private,0.171808,5398863.172545613,"São Paulo, Brazil",SiDi,A100,Calculated from Top500,2021-06-01,,11.560141207399278,,,,,,,200.0,83.0,16.79518458968242,1.248e+17,1.248e+17,6.24e+16,31200000000000000,0.171808,,363196125907.9903,5398863.172545613,,,,,Sunway OceanLight,0.0209909267526454,400.0,80.0,0.0,0.0
513,Argonne NL Sophia (Formerly Theta),Existing,Confirmed,Yes,17.07848581838597,60.539666499122674,NVIDIA A100,192.0,United States of America,US Department of Energy,2020-05-30,"This was originally an addition of a GPU portion of the Theta supercomputer. The Theta supercomputer has since been retired, and these GPUs were shifted to the Sophia supercomputer",Public,0.1677311999999999,5286779.721717792,,Argonne National Laboratory and general scientific community,A100,the augmented Theta architecture adds 24 NVIDIA DGX A100 nodes to the existing system. Each DGX A100 node comprises eight NVIDIA A100 Tensor Core GPUs,2020-05-30,,11.55284196865778,,,,,,,192.0,38.0,16.77745582272199,1.19808e+17,1.19808e+17,5.9904e+16,29952000000000000,0.1677311999999999,,357142857142.8572,5286779.721717792,,,,,Oak Ridge NL Summit,0.0346666666666666,400.0,80.0,0.0,0.0
514,Atos Spartan2,Existing,Confirmed,Yes,17.07848581838597,60.539666499122674,NVIDIA A100,192.0,France,,2020-11-01,,Private,0.1894,5205521.685109948,France,Cloud,A100,Calculated from Top500,2020-11-01,,11.500075848054736,,,,,,,192.0,52.0,16.77745582272199,1.19808e+17,1.19808e+17,5.9904e+16,29952000000000000,0.1677311999999999,0.1894,316282998944.0338,5205521.685109948,,,,,Oak Ridge NL Summit,0.0346666666666666,400.0,80.0,0.0,0.0
515,Commissariat a l'Energie Atomique Topaze,Existing,Confirmed,Yes,17.07848581838597,60.539666499122674,NVIDIA A100,192.0,France,French Alternative Energies and Atomic Energy Commission (CEA),2021-06-23,,Public,0.16493568,5170689.466366189,"Essonne, France","Researchers,Industry",A100,Calculated from Top500,2021-06-23,,11.560141207399278,,,,,,,192.0,89.0,16.77745582272199,1.19808e+17,1.19808e+17,5.9904e+16,29952000000000000,0.16493568,,363196125907.9904,5170689.466366189,,,,,Sunway OceanLight,0.0201512896825396,400.0,80.0,0.0,0.0
516,Dell Rattler,Existing,Confirmed,Yes,17.07848581838597,60.539666499122674,NVIDIA A100,192.0,United States of America,Dell Technologies,2021-11-01,,Private,0.16493568,6555149.780489707,"Austin, Texas",Dell,A100,Calculated from Top500,2021-11-01,,11.560141207399278,,,,,,,192.0,110.0,16.77745582272199,1.19808e+17,1.19808e+17,5.9904e+16,29952000000000000,0.16493568,,363196125907.9904,6555149.780489707,,,,,DeepSeek Fire-Flyer 2,0.0192,400.0,80.0,0.0,0.0
517,High-Performance Computing Center Stuttgart Hawk,Existing,Confirmed,Yes,17.07848581838597,60.539666499122674,NVIDIA A100,192.0,Germany,University of Stuttgart,2021-09-20,,Public,0.16493568,6554808.902020263,"Nobelstraße 19, 70569 Stuttgart, Germany","Academia,Industry",A100,Hawk's upgrade consists of 24 HPE Apollo 6500 Gen10 Plus systems with 192 NVIDIA A100 GPUs based on the NVIDIA Ampere architecture,2021-09-20,,11.560141207399278,,,,,,,192.0,98.0,16.77745582272199,1.19808e+17,1.19808e+17,5.9904e+16,29952000000000000,0.16493568,,363196125907.9904,6554808.902020263,,,,,DeepSeek Fire-Flyer 2,0.0192,400.0,80.0,0.0,0.0
518,MIT LLSC TX-GAIA,Existing,Confirmed,Yes,17.049218022670182,56.59423951574004,NVIDIA V100,896.0,United States of America,US Department of Defense,2019-09-26,,Public,2.5719,17476581.144923903,"MIT Lincoln Laboratory Supercomputing Center
50 Water St, Holyoke, MA 01040",MIT,V100,"has just installed a new GPU-accelerated supercomputer, powered by 896 NVIDIA Tensor Core V100 GPUs",2019-09-26,Confirmed by NVIDIA blog,10.638963944223784,,,,,,,896.0,24.0,17.049218022670182,1.12e+17,,1.12e+17,14040320000000000,0.5968435200000001,2.5719,43547571834.05264,17476581.144923903,,,,,Oak Ridge NL Summit,0.0324074074074076,300.0,16.0,0.0,0.0
519,Nagoya University Flow Type II (Furo),Existing,Confirmed,Yes,17.043362278021128,55.83628095079686,NVIDIA Tesla V100 SXM2,884.0,Japan,Nagoya University,2020-07-30,,Public,0.5791968,18406892.280572724,"Nagoya, Japan",Academia,V100,Calculated from Top500,2020-07-30,,11.280536124255692,,,,,,,884.0,45.0,17.043362278021128,1.105e+17,,1.105e+17,13852280000000000,0.5791968,,190781440781.4408,18406892.280572724,,,,,Oak Ridge NL Summit,0.0319733796296297,300.0,16.0,0.0,0.0
520,CSCS Piz Daint Phase 2,Existing,Confirmed,Yes,17.036074496855445,54.9071248113187,NVIDIA Tesla P100 PCIe 16GB,5704.0,Switzerland,ETH Domain,2017-06-01,,Public,4.3744,121339528.5894564,,"Swiss Universities,Academia",P100,NVIDIA® Tesla® P100 16GB - 5704 Nodes,2017-06-01,,10.39515600396772,CSCS Piz Daint Phase 1,,,,,,5704.0,2.0,17.036074496855445,1.086612e+17,,1.086612e+17,54336304000000000,3.3479628000000003,4.3744,24840252377.46891,121339528.5894564,,,,,Google TensorFlow Research Cloud,0.5895247395833337,250.0,16.0,0.0,0.0
521,Japanese Research Institute 1 Supercomputer 1,Existing,Confirmed,Yes,17.017033339298777,52.5517938360439,NVIDIA Tesla V100 SXM2,832.0,Japan,,2019-06-01,,,0.55421184,17951819.922399994,Japan,,V100,Calculated from Top500,2019-06-01,,11.27335753962857,,,,,,,832.0,21.0,17.017033339298777,1.04e+17,,1.04e+17,13037440000000000,0.55421184,,187653876178.4664,17951819.922399994,,,,,Oak Ridge NL Summit,0.0300925925925925,300.0,16.0,0.0,0.0
522,Microsoft Azure ND v2 Largest Stated,Existing,Confirmed,Yes,17.0,50.53057099619643,NVIDIA V100,800.0,United States of America,Microsoft,2019-11-18,"This was the largest size mentioned. There were likely smaller ones as well, and possibly multiple of this size",Private,0.532896,15562293.6375,,"Cloud,Azure",V100,"Built to handle the most demanding AI and high performance computing applications, the largest deployments of Azure’s new NDv2 instance rank among the world’s fastest supercomputers, offering up to 800 NVIDIA V100 Tensor Core GPUs",2019-11-18,,11.27335753962857,,,,,,,800.0,31.0,17.0,1e+17,,1e+17,12536000000000000,0.532896,,187653876178.4664,15562293.6375,,,,,Oak Ridge NL Summit,0.0289351851851853,300.0,16.0,0.0,0.0
523,MTS Grom,Existing,Confirmed,Yes,16.99930457233835,50.449722082602605,NVIDIA A100,160.0,Russia,MTS,2021-06-01,,Private,0.1374464,4319090.538036489,Russia,"MTS,Cloud",A100,Calculated from Top500,2021-06-01,,11.560141207399278,,,,,,,160.0,91.0,16.698274576674365,9.984e+16,9.984e+16,4.992e+16,24960000000000000,0.1374464,,363196125907.9904,4319090.538036489,,,,,Sunway OceanLight,0.0167927414021164,400.0,80.0,0.0,0.0
524,NVIDIA Tethys,Existing,Confirmed,Yes,16.99930457233835,50.449722082602605,NVIDIA A100,160.0,United States of America,NVIDIA,2021-11-01,,Private,0.1259,5462624.817074756,,NVIDIA,A100,Calculated from Top500,2021-11-01,,11.598248846566504,,,,,,,160.0,121.0,16.698274576674365,9.984e+16,9.984e+16,4.992e+16,24960000000000000,0.1374464,0.1259,396505162827.6409,5462624.817074756,,,,,DeepSeek Fire-Flyer 2,0.0160000000000001,400.0,80.0,0.0,0.0
525,Vingroup VinAI Research Superpod,Existing,Likely,Yes,16.99930457233835,50.449722082602605,NVIDIA A100,160.0,Vietnam,Vingroup,2021-05-30,,Private,0.1374464,4319090.538036489,Vietnam,VinAI Research,A100,who hopes to have in May the new cluster of 20 DGX A100 systems linked together with an NVIDIA Mellanox HDR 200Gb/s InfiniBand network,2021-05-30,,11.560141207399278,,,,,,,160.0,78.0,16.698274576674365,9.984e+16,9.984e+16,4.992e+16,24960000000000000,0.1374464,,363196125907.9904,4319090.538036489,,,,,Sunway OceanLight,0.0167927414021164,400.0,80.0,0.0,0.0
526,Anonymized Chinese System,Existing,Confirmed,Yes,16.95424250943932,50.0,,700.0,China,,2019-11-15,,Private,0.5,10000000.0,China,,,,,,11.255272505103305,,,,,,,700.0,30.0,16.95424250943932,9e+16,,9e+16,10000000000000000,0.5,,180000000000.0,10000000.0,,,,,Oak Ridge NL Summit,0.03,0.0,0.0,0.0,0.0
527,Anonymized Chinese System,Existing,Confirmed,Yes,17.0,50.0,,,China,,2021-10-15,,Public,,,China,,,,,,,,,,,,,,106.0,17.0,1.0000000000000002e+17,,1.0000000000000002e+17,,,,,,,,,,DeepSeek Fire-Flyer 2,0.02,0.0,0.0,0.0,0.0
528,Simon Fraser University/Compute Canada Cedar,Existing,Confirmed,Yes,16.982271233039565,48.509348156348224,NVIDIA V100,768.0,Canada,Compute Canada,2020-06-01,,Public,0.5552,14664836.213006135,"8888 University Dr W, Burnaby, BC V5A 1S6, Canada","Academia,Researchers",V100,Calculated from Top500,2020-06-01,,11.237821775592767,,,,,,,768.0,45.0,16.982271233039565,9.6e+16,,9.6e+16,12034560000000000,0.5031936,0.5552,172910662824.2075,14664836.213006135,,,,,Oak Ridge NL Summit,0.0277777777777777,300.0,16.0,0.0,0.0
529,SAKURA Internet 2019 V100 Supercomputer,Existing,Confirmed,Yes,16.982271233039565,48.509348156348224,NVIDIA Tesla V100 SXM2,768.0,Japan,Sakura Internet,2019-06-01,,Private,0.51158016,16570910.697599998,,Cloud,V100,Calculated from Top500,2019-06-01,,11.27335753962857,,,,,,,768.0,22.0,16.982271233039565,9.6e+16,,9.6e+16,12034560000000000,0.51158016,,187653876178.4664,16570910.697599998,,,,,Oak Ridge NL Summit,0.0277777777777777,300.0,16.0,0.0,0.0
530,Petrobras Fênix Phase 2,Existing,Confirmed,Yes,16.95424250943932,45.47751389657645,NVIDIA V100,720.0,Brazil,Petrobras,2020-06-01,,Public/Private,0.6981,13748283.949693251,"Rio de Janeiro, Brazil",Petrobras,V100,Calculated from Top500,2020-06-01,,11.110324871432931,Petrobras Fênix Phase 1,,,,,,720.0,47.0,16.95424250943932,9e+16,,9e+16,11282400000000000,0.471744,0.6981,128921357971.6373,13748283.949693251,,,,,Oak Ridge NL Summit,0.0260416666666666,300.0,16.0,0.0,0.0
531,Samsung SSC-21 Scalable Module,Existing,Confirmed,Yes,16.95354708177767,45.40474987434201,NVIDIA A100,144.0,Korea (Republic of),Samsung,2021-11-01,This is different than Samsung SSC-21,Private,0.1814,4916362.335367281,Korea (Republic of),Samsung,A100,Calculated from Top500,2021-11-01,Listed in Top500,11.393879803389614,,,,,,,144.0,128.0,16.65251708611369,8.9856e+16,8.9856e+16,4.4928e+16,22464000000000000,0.12370176,0.1814,247673649393.6053,4916362.335367281,,,,,DeepSeek Fire-Flyer 2,0.0144,400.0,80.0,0.0,0.0
532,Calcul Québec Béluga,Existing,Confirmed,Yes,16.934498451243567,43.456291056728816,NVIDIA V100,688.0,Canada,Compute Canada,2019-04-26,,Public,0.437,13602178.976079855,"1100 Notre-Dame St W, Montreal, Quebec H3C 1K3, Canada",Academia,V100,"The GPU subsection, meanwhile, was measured at 2.278 Linpack petaflops and consists of 172 Intel-based servers utilizing 688 Nvidia Volta GPUs",2019-04-26,,11.294017014273145,,,,,,,688.0,19.0,16.934498451243567,8.6e+16,,8.6e+16,10780960000000000,0.45829056,0.437,196796338672.7689,13602178.976079855,,,,,Oak Ridge NL Summit,0.0248842592592593,300.0,16.0,0.0,0.0
533,Preferred Networks MN-1b,Decommissioned,Confirmed,Yes,16.919855985880986,42.01556341648524,NVIDIA V100,512.0,Japan,Preferred Networks Inc,2018-07-30,Decommissioned July 2022,Private,0.93929472,10104213.84,Japan,Preferred Networks,"V100,P100","The system featured 1,024 Nvidia Tesla P100 GPUs achieving a peak compute of 1.39 petaFLOPS and 9.3 petaFLOPS of SP from the GPU. At the time, the MN-1 ranked 1st in Japan and 12th in the world on the TOP500 among industrial supercomputers. In July 2018 PFN enhanced the MN-1 by adding 512 additional Tesla V100 GPUs",2018-07-30,,10.947054104810574,,,,,NVIDIA P100,1024.0,1536.0,13.0,16.919855985880986,8.31488e+16,,8.31488e+16,17546240000000000,0.93929472,,88522588522.58853,10104213.84,,,,2021-07,Oak Ridge NL Summit,0.0240592592592593,300.0,16.0,300.0,16.0
534,NCI Australia Gadi,Existing,Confirmed,Yes,16.903089986991944,40.42445679695716,NVIDIA Tesla V100 SXM2,640.0,Australia,National Computational Infrastructure Australia,2020-01-23,,Public,0.419328,13431927.613913655,"Canberra ACT 2601, Australia","Academia,Researchers",V100,160 nodes each containing four Nvidia V100 GPUs and two 24-core Intel Xeon Scalable 'Cascade Lake' processor,2020-01-23,,11.280536124255692,,,,,,,640.0,40.0,16.903089986991944,8e+16,,8e+16,10028800000000000,0.419328,,190781440781.4408,13431927.613913655,,,,,Oak Ridge NL Summit,0.0231481481481483,300.0,16.0,0.0,0.0
535,PLUG training cluster,Existing,Likely,Yes,16.902394559330293,40.3597776660821,NVIDIA A100,128.0,,,2021-04-19,,,0.1099571199999999,3455272.430429192,,,A100,,2021-04-19,,11.560141207399278,,,,,,,128.0,86.0,16.60136456366631,7.9872e+16,7.9872e+16,3.9936e+16,19968000000000000,0.1099571199999999,,363196125907.9904,3455272.430429192,,,,,Sunway OceanLight,0.0134341931216932,400.0,80.0,0.0,0.0
536,Anonymized Chinese System,Existing,Confirmed,Yes,16.903089986991944,40.0,,600.0,China,,2019-07-15,,Private,0.4,10000000.0,China,,,,,,11.30102999566398,,,,,,,600.0,28.0,16.903089986991944,8e+16,,8e+16,10000000000000000,0.4,,200000000000.0,10000000.0,,,,,Oak Ridge NL Summit,0.02,0.0,0.0,0.0,0.0
537,Anonymized Chinese System,Existing,Confirmed,Yes,16.903089986991944,40.0,,600.0,China,,2019-11-15,,Public,0.4,10000000.0,China,,,,,,11.30102999566398,,,,,,,600.0,40.0,16.903089986991944,8e+16,,8e+16,10000000000000000,0.4,,200000000000.0,10000000.0,,,,,Oak Ridge NL Summit,0.02,0.0,0.0,0.0,0.0
538,Anonymized Chinese System,Existing,Confirmed,Yes,16.845098040014253,40.0,,600.0,China,,2019-11-15,,Private,0.4,10000000.0,China,,,,,,11.243038048686293,,,,,,,600.0,50.0,16.845098040014253,7e+16,,7e+16,8999999999999999,0.4,,175000000000.0,10000000.0,,,,,Oak Ridge NL Summit,0.02,0.0,0.0,0.0,0.0
539,Anonymized Chinese System,Existing,Confirmed,Yes,16.903089986991944,40.0,,600.0,China,,2020-07-15,,Public,0.4,10000000.0,China,,,,,,11.30102999566398,,,,,,,600.0,64.0,16.903089986991944,8e+16,,8e+16,10000000000000000,0.4,,200000000000.0,10000000.0,,,,,Oak Ridge NL Summit,0.02,0.0,0.0,0.0,0.0
540,Anonymized Chinese System,Existing,Confirmed,Yes,16.903089986991944,40.0,,600.0,China,,2020-06-15,,Private,0.4,10000000.0,China,,,,,,11.30102999566398,,,,,,,600.0,52.0,16.903089986991944,8e+16,,8e+16,10000000000000000,0.4,,200000000000.0,10000000.0,,,,,Oak Ridge NL Summit,0.02,0.0,0.0,0.0,0.0
541,Anonymized Chinese System,Existing,Confirmed,Yes,16.845098040014253,40.0,,600.0,China,,2020-07-15,,Public/Private,0.4,10000000.0,China,,,,,,11.243038048686293,,,True,,,,600.0,80.0,16.845098040014253,7e+16,,7e+16,8999999999999999,0.4,,175000000000.0,10000000.0,,,,,Oak Ridge NL Summit,0.02,0.0,0.0,0.0,0.0
542,Anonymized Chinese System,Existing,Confirmed,Yes,16.903089986991944,40.0,,700.0,China,,2018-06-15,,Private,0.5,10000000.0,China,,,,,,11.204119982655923,,,,,,,700.0,12.0,16.903089986991944,8e+16,,8e+16,10000000000000000,0.5,,160000000000.0,10000000.0,,,,,Meta 2017 V100 Cluster,0.03,0.0,0.0,0.0,0.0
543,Anonymized Chinese System,Existing,Confirmed,Yes,16.903089986991944,40.0,,600.0,China,,2018-07-15,,Private,0.4,10000000.0,China,,,,,,11.30102999566398,,,,,,,600.0,14.0,16.903089986991944,8e+16,,8e+16,10000000000000000,0.4,,200000000000.0,10000000.0,,,,,Oak Ridge NL Summit,0.02,0.0,0.0,0.0,0.0
544,Anonymized Chinese System,Existing,Confirmed,Yes,16.845098040014253,40.0,,600.0,China,,2020-06-15,,Private,0.4,10000000.0,China,,,,,,11.243038048686293,,,,,,,600.0,76.0,16.845098040014253,7e+16,,7e+16,8999999999999999,0.4,,175000000000.0,10000000.0,,,,,Oak Ridge NL Summit,0.02,0.0,0.0,0.0,0.0
545,Anonymized Chinese System,Existing,Confirmed,Yes,16.903089986991944,40.0,,600.0,China,,2020-06-15,,Private,0.4,10000000.0,China,,,,,,11.30102999566398,,,,,,,600.0,52.0,16.903089986991944,8e+16,,8e+16,10000000000000000,0.4,,200000000000.0,10000000.0,,,,,Oak Ridge NL Summit,0.02,0.0,0.0,0.0,0.0
546,Anonymized Chinese System,Existing,Confirmed,Yes,16.845098040014253,40.0,,600.0,China,,2020-06-15,,Public/Private,0.4,10000000.0,China,,,,,,11.243038048686293,,,,,,,600.0,71.0,16.845098040014253,7e+16,,7e+16,8999999999999999,0.4,,175000000000.0,10000000.0,,,,,Oak Ridge NL Summit,0.02,0.0,0.0,0.0,0.0
547,Anonymized Chinese System,Existing,Confirmed,Yes,16.845098040014253,40.0,,600.0,China,,2019-11-15,,Private,0.4,10000000.0,China,,,,,,11.243038048686293,,,,,,,600.0,50.0,16.845098040014253,7e+16,,7e+16,8999999999999999,0.4,,175000000000.0,10000000.0,,,,,Oak Ridge NL Summit,0.02,0.0,0.0,0.0,0.0
548,Anonymized Chinese System,Existing,Confirmed,Yes,16.845098040014253,40.0,,600.0,China,,2020-06-15,,Private,0.4,10000000.0,China,,,,,,11.243038048686293,,,,,,,600.0,76.0,16.845098040014253,7e+16,,7e+16,8999999999999999,0.4,,175000000000.0,10000000.0,,,,,Oak Ridge NL Summit,0.02,0.0,0.0,0.0,0.0
549,Anonymized Chinese System,Existing,Confirmed,Yes,16.845098040014253,40.0,,600.0,China,,2020-07-15,,Private,0.3,10000000.0,China,,,,,,11.367976785294593,,,,,,,600.0,79.0,16.845098040014253,7e+16,,7e+16,8999999999999999,0.3,,233333333333.3333,10000000.0,,,,,Oak Ridge NL Summit,0.02,0.0,0.0,0.0,0.0
550,Anonymized Chinese System,Existing,Confirmed,Yes,16.845098040014253,40.0,,600.0,China,,2019-11-15,,Private,0.4,10000000.0,China,,,,,,11.243038048686293,,,,,,,600.0,50.0,16.845098040014253,7e+16,,7e+16,8999999999999999,0.4,,175000000000.0,10000000.0,,,,,Oak Ridge NL Summit,0.02,0.0,0.0,0.0,0.0
551,Anonymized Chinese System,Existing,Confirmed,Yes,16.903089986991944,40.0,,600.0,China,,2019-11-15,,Private,0.4,10000000.0,China,,,,,,11.30102999566398,,,,,,,600.0,41.0,16.903089986991944,8e+16,,8e+16,8999999999999999,0.4,,200000000000.0,10000000.0,,,,,Oak Ridge NL Summit,0.02,0.0,0.0,0.0,0.0
552,Anonymized Chinese System,Existing,Confirmed,Yes,16.903089986991944,40.0,,600.0,China,,2020-06-15,,Private,0.4,10000000.0,China,,,,,,11.30102999566398,,,,,,,600.0,64.0,16.903089986991944,8e+16,,8e+16,8999999999999999,0.4,,200000000000.0,10000000.0,,,,,Oak Ridge NL Summit,0.02,0.0,0.0,0.0,0.0
553,Anonymized Chinese System,Existing,Confirmed,Yes,16.903089986991944,40.0,,600.0,China,,2020-06-15,,Private,0.4,10000000.0,China,,,,,,11.30102999566398,,,,,,,600.0,52.0,16.903089986991944,8e+16,,8e+16,10000000000000000,0.4,,200000000000.0,10000000.0,,,,,Oak Ridge NL Summit,0.02,0.0,0.0,0.0,0.0
