,name,status,certainty,single_cluster,max_ops_log,h100_equivalents,chip_type_primary,chip_quantity_primary,country,owner,first_operational_date,note,sector,power_capacity_mw,hardware_cost,location,users,hardware_note,quote,first_operational_date_note,certainty_note,energy_efficiency_log,builds_upon,superseded_by,possible_duplicate,possible_duplicate_of,chip_type_secondary,chip_quantity_secondary,total_number_of_ai_chips,rank_when_first_operational,16bit_ops_log,max_ops,8bit_ops,16bit_ops,32bit_ops,calculated_power_capacity_mw,reported_power_capacity_mw,energy_efficiency,calculated_cost,reported_cost,reported_cost_inflation_adjusted,cost_quote,decommissioned_date_if_applicable,largest_existing_cluster_when_first_operational,percent_of_largest_cluster_when_first_operational,primary_tdp_w,primary_vram_gb,secondary_tdp_w,secondary_vram_gb
141,Mare Nostrum 5,Existing,Confirmed,Yes,18.94772380820454,4480.000000065971,NVIDIA H100 SXM5 80GB,4480.0,Spain,"Barcelona Supercomputing Center,EuroHPC JU",2023-11-01,,Public,6.0,162157070.19671246,"Barcelona Supercomputing Center
Plaça d'Eusebi Güell, 1-3, Les Corts, 08034 Barcelona, Spain",European science and industry communities,H100,1120 nodes with 4 Hopper GPUs each,2023-11-01,Specs on their official website,11.868498669642662,,,,,,,4480.0,10.0,18.646649920026302,8.86592e+18,8.86592e+18,4.432512e+18,2216256000000000000,6.5065728,6.0,738752000000.0,148279882.65677443,159400000.0,162157070.19671246,"The budget is set for €151.41 million, which is $159.4 million with current US dollar exchange rates to the euro.",,Tesla 10k H100 Cluster,0.4480000000000004,700.0,80.0,0.0,0.0
142,Together AI H100 Cluster,Existing,Likely,Yes,18.94226091250304,4424.000000065149,NVIDIA H100 SXM5 80GB,4424.0,United States of America,Together,2023-10-16,Unclear if all the GPUs are networked together,Private,6.425240639999999,146721675.82831895,,Cloud,H100,Our first large H100 cluster (4424 GPUs) starts coming online today!,2023-10-16,,11.833297626692357,,,,,,,4424.0,9.0,18.641187024324804,8.755096e+18,8.755096e+18,4.3771056e+18,2188552800000000000,6.425240639999999,,681236057175.9069,146721675.82831895,,,,,Tesla 10k H100 Cluster,0.4424000000000007,700.0,80.0,0.0,0.0
143,EuroHPC Leonardo,Existing,Confirmed,Yes,18.93581831481724,4358.855987936838,NVIDIA A100,13824.0,Italy,EuroHPC JU,2022-11-22,,Public,12.5985,280971647.2256874,"Via Piero Gobetti, 101, 40129 Bologna BO, Italy","European researchers,academia,and industry",A100,"This result is achieved with 3456 computing nodes, each equipped with four NVIDIA  A100 SXM6 64GB  GPUs driven by a single 32-cores Intel Ice Lake CPU.",2022-11-22,,11.53446947883746,,,,,,,13824.0,5.0,18.63478831915326,8.626176e+18,8.626176e+18,4.313088e+18,2156544000000000000,11.774730239999998,12.5985,342349327300.86914,311419540.35140723,272208000.0,280971647.2256874,Cost 240M Euros in 2022,,Microsoft GPT-4 cluster,0.5529599999999969,400.0,80.0,0.0,0.0
144,Amazon Titan training cluster,Existing,Likely,Yes,18.93380302358192,4338.676099103813,NVIDIA A100,13760.0,United States of America,Amazon,2023-01-15,"Model was released to large clients April 2023, took 48 days to train, so this cluster was operational at least three months beforehand",Private,11.419699199999998,309575729.94726515,,Amazon,A100,"Specifically, they trained a 200B dense model on 4T tokens of data across 13,760 NVIDIA A100 chips (using 1,720 P4d nodes)",2023-01,,11.575118363368931,,,,,,,13760.0,6.0,18.63277302791793,8.58624e+18,8.58624e+18,4.29312e+18,2146560000000000000,11.419699199999998,,375939849624.0602,309575729.94726515,,,,,Microsoft GPT-4 cluster,0.550399999999999,400.0,80.0,0.0,0.0
145,Google Hypercomputer TPU v5p pod,Existing,Confirmed,Yes,18.915150690863367,4156.28095003594,Google TPU v5p,8960.0,,Google,2023-12-06,"The ""Hypercomputer"" is a cloud network, a TPU v5p pod seems to just be one component. Versions of this pod likely exist in multiple locations, possibly around the world",Private,10.038712319999998,57598146.17527369,,"Google,Cloud",TPUv5p,"Each TPU v5p pod composes together 8,960 chips over our highest-bandwidth inter-chip interconnect (ICI) at 4,800 Gbps/chip in a 3D torus topology.",2023-12-06,,11.612442686392743,,,,,,,8960.0,18.0,18.614120695199382,8.22528e+18,8.22528e+18,4.11264e+18,,10.038712319999998,,409678041256.9887,57598146.17527369,,,,,Microsoft Azure Eagle,0.2886306215260232,450.0,95.0,0.0,0.0
146,Yotta Shakti Cloud NM1 Phase 1,Existing,Confirmed,Yes,18.90880574217417,4096.00000006032,NVIDIA H100 SXM5 80GB,4096.0,India,Yotta Data Services,2024-05-15,There is evidence on GPU listings of this portion being operational. The date comes from an article a month earlier saying when they expect to officially go live,Private,5.844500480000001,145703820.78798905,"Yotta Datacenter Park - Panvel Hiranandani Fortune City. Survey No. 30, MH SH 76, Panvel, Navi Mumbai, Maharashtra 410206, India",Cloud,H100,"""Yotta’s first slot of more than 4,000 GPUs was already booked by enterprises and is expected to go live by May 15, 2024""
""Yotta will deploy the first cluster of 16,384 GPUs at NM1""",2024-05-15,,11.840984455358647,,,,,,,4096.0,25.0,18.607731853995933,8.105984e+18,8.105984e+18,4.0525824e+18,2026291200000000000,5.844500480000001,,693400986768.3336,145703820.78798905,,,,,Meta GenAI 2024a,0.1666666666666665,700.0,80.0,0.0,0.0
147,Sesterce Synapse Phase 2,Existing,Likely,Yes,18.90880574217417,4096.00000006032,NVIDIA H200 SXM,4096.0,France,Sesterce,2025-01-15,,Private,5.7401344000000005,144832469.2992,"Paris, France",Cloud,H200,Private Correspondence,2025-01-15,,11.848853685384858,Sesterce Synapse Phase 1,,,,,,4096.0,44.0,18.60777574651019,8.105984e+18,8.105984e+18,4.052992e+18,2025472000000000000,5.7401344000000005,,706079634651.0632,144832469.2992,,,,,xAI Colossus Memphis Phase 1,0.0409600000000004,700.0,141.0,0.0,0.0
148,Sesterce H100s Phase 2,Existing,Likely,Yes,18.90880574217417,4096.00000006032,NVIDIA H100 SXM5 80GB,4096.0,France,Sesterce,2024-07-06,,Private,5.844500480000001,145966387.42898926,"Paris, France",Cloud,H100,From a private correspondence,2024-07-06,,11.840984455358647,Sesterce H100s Phase 1,,,,,,4096.0,29.0,18.607731853995933,8.105984e+18,8.105984e+18,4.0525824e+18,2026291200000000000,5.844500480000001,,693400986768.3336,145966387.42898926,,,,,Meta GenAI 2024a,0.1666666666666665,700.0,80.0,0.0,0.0
149,PanaAI AUS AISF,Planned,Likely,Yes,18.90795668133305,4088.000000060189,NVIDIA H200 SXM,4088.0,Australia,PanaAI,,,Private,5.7289232000000005,146060910.18584076,Australia,Cloud,H200,It will host up to 4088 NVIDIA H200 Tensor Core GPUs,Planned Q1 2025,,11.848853685384858,,,,,,,4088.0,,18.60692668566907,8.090152e+18,8.090152e+18,4.045076e+18,2021516000000000000,5.7289232000000005,,706079634651.0632,146060910.18584076,,,,,,,700.0,141.0,0.0,0.0
150,Voltage Park Virginia,Planned,Likely,Yes,18.90795668133305,4088.000000060189,NVIDIA H100 SXM5 80GB,4088.0,United States of America,Voltage Park,,"They offer configurations up to 4,088 GPUs, which suggests that their largest cluster is 4k, therefore all clusters would be roughly of size 4k",Private,5.7289232000000005,192138009.3776681,Virginia,Cloud,H100,"With 24,000 H100 GPUs spread across six geographically distinct data centers",Planned,"Unclear if the 24k chips are divided equally among the six locations. They offer clusters up to size 4,088 GPUs, though",11.848809792870606,,,,,,,4088.0,,18.606882793154817,8.090152e+18,8.090152e+18,4.0446672e+18,2022333600000000000,5.7289232000000005,,706008277436.8489,192138009.3776681,,,,,,,700.0,80.0,0.0,0.0
151,Voltage Park Location 6,Planned,Likely,Yes,18.90795668133305,4088.000000060189,NVIDIA H100 SXM5 80GB,4088.0,United States of America,Voltage Park,,"They offer configurations up to 4,088 GPUs, which suggests that their largest cluster is 4k, therefore all clusters would be roughly of size 4k",Private,5.7289232000000005,192138009.3776681,,Cloud,H100,"With 24,000 H100 GPUs spread across six geographically distinct data centers",Planned,"Unclear if the 24k chips are divided equally among the six locations. They offer clusters up to size 4,088 GPUs, though",11.848809792870606,,,,,,,4088.0,,18.606882793154817,8.090152e+18,8.090152e+18,4.0446672e+18,2022333600000000000,5.7289232000000005,,706008277436.8489,192138009.3776681,,,,,,,700.0,80.0,0.0,0.0
152,Voltage Park Texas Phase 2,Planned,Likely,Yes,18.90795668133305,4088.000000060189,NVIDIA H100 SXM5 80GB,4088.0,United States of America,Voltage Park,,"They offer configurations up to 4,088 GPUs, which suggests that their largest cluster is 4k, therefore all clusters would be roughly of size 4k",Private,5.7289232000000005,192138009.3776681,Texas,Cloud,H100,"With 24,000 H100 GPUs spread across six geographically distinct data centers",Planned,"Unclear if the 24k chips are divided equally among the six locations. They offer clusters up to size 4,088 GPUs, though",11.848809792870606,Voltage Park Texas Phase 1,,,,,,4088.0,,18.606882793154817,8.090152e+18,8.090152e+18,4.0446672e+18,2022333600000000000,5.7289232000000005,,706008277436.8489,192138009.3776681,,,,,,,700.0,80.0,0.0,0.0
153,Voltage Park Location 5,Planned,Likely,Yes,18.90795668133305,4088.000000060189,NVIDIA H100 SXM5 80GB,4088.0,United States of America,Voltage Park,,"They offer configurations up to 4,088 GPUs, which suggests that their largest cluster is 4k, therefore all clusters would be roughly of size 4k",Private,5.7289232000000005,192138009.3776681,,Cloud,H100,"With 24,000 H100 GPUs spread across six geographically distinct data centers",Planned,"Unclear if the 24k chips are divided equally among the six locations. They offer clusters up to size 4,088 GPUs, though",11.848809792870606,,,,,,,4088.0,,18.606882793154817,8.090152e+18,8.090152e+18,4.0446672e+18,2022333600000000000,5.7289232000000005,,706008277436.8489,192138009.3776681,,,,,,,700.0,80.0,0.0,0.0
154,Voltage Park Utah,Planned,Likely,Yes,18.90795668133305,4088.000000060189,NVIDIA H100 SXM5 80GB,4088.0,United States of America,Voltage Park,,"They offer configurations up to 4,088 GPUs, which suggests that their largest cluster is 4k, therefore all clusters would be roughly of size 4k",Private,5.7289232000000005,192138009.3776681,Utah,Cloud,H100,"With 24,000 H100 GPUs spread across six geographically distinct data centers",Planned,"Unclear if the 24k chips are divided equally among the six locations. They offer clusters up to size 4,088 GPUs, though",11.848809792870606,,,,,,,4088.0,,18.606882793154817,8.090152e+18,8.090152e+18,4.0446672e+18,2022333600000000000,5.7289232000000005,,706008277436.8489,192138009.3776681,,,,,,,700.0,80.0,0.0,0.0
155,Voltage Park Washington,Planned,Likely,Yes,18.90795668133305,4088.000000060189,NVIDIA H100 SXM5 80GB,4088.0,United States of America,Voltage Park,,"They offer configurations up to 4,088 GPUs, which suggests that their largest cluster is 4k, therefore all clusters would be roughly of size 4k",Private,5.7289232000000005,192138009.3776681,"1023 39th Ave SE, Puyallup, WA 98374",Cloud,H100,"With 24,000 H100 GPUs spread across six geographically distinct data centers",Planned,"Unclear if the 24k chips are divided equally among the six locations. They offer clusters up to size 4,088 GPUs, though",11.848809792870606,,,,,,,4088.0,,18.606882793154817,8.090152e+18,8.090152e+18,4.0446672e+18,2022333600000000000,5.7289232000000005,,706008277436.8489,192138009.3776681,,,,,,,700.0,80.0,0.0,0.0
156,ExxonMobil Discovery 6,Existing,Confirmed,Yes,18.90196631764386,4032.000000059345,NVIDIA GH200,4032.0,United States of America,ExxonMobil,2025-06-15,,Private,5.650444800000001,,"22777 Springwoods Village Pkwy, Spring, TX 77389",ExxonMobil,GH200,"""machine consists of 4,032 Nvidia Grace Hopper Superchips""",2025-06,,11.848853685384858,,,,,,,4032.0,,18.600936321979884,7.979328e+18,7.979328e+18,3.989664e+18,1993824000000000000,5.650444800000001,,706079634651.0631,,,,,,,,1000.0,141.0,0.0,0.0
157,Telangana Yotta H1 Hyderbad AI City Cluster Phase 1,Planned,Likely,Yes,18.89850578553436,4000.0000000589,NVIDIA H100 SXM5 80GB,4000.0,India,Government of Telangana,,,Public,5.6056,188001966.1229629,"Hyderabad, India",Cloud,H100,"The first phase of the Supercomputer consisting of 4,000 high performance GPUs and the first Data Center within the campus, Yotta H1 will be operational within the next 24 months",Planned 2026,,11.848809792870606,,,,,,,4000.0,,18.597431897356124,7.916e+18,7.916e+18,3.9576e+18,1978800000000000000,5.6056,,706008277436.8489,188001966.1229629,,,,,,,700.0,80.0,0.0,0.0
158,OneAsia OBON Clusters,Planned,Likely,Yes,18.89850578553436,4000.0000000589,NVIDIA H100 SXM5 80GB,4000.0,Thailand,OneAsia,,,Private,5.6056,188001966.1229629,"Bangkok, Thailand","Cloud,OBON,SIAM AI",H100,OBON will deploy multiple 4K supercomputing clusters at OneAsia's state-of-the-art data centre,Planned,,11.848809792870606,,,,,,,4000.0,,18.597431897356124,7.916e+18,7.916e+18,3.9576e+18,1978800000000000000,5.6056,,706008277436.8489,188001966.1229629,,,,,,,700.0,80.0,0.0,0.0
159,CoreWeave LiquidLab,Existing,Likely,Yes,18.89850578553436,4000.0000000589,NVIDIA H100 SXM5 80GB,4000.0,United States of America,CoreWeave,,Unclear exactly what type of GPU they use. Likely operational by now,Private,5.6056,188001966.1229629,,CoreWeave,H100,"CoreWeave has a Liquid Lab where we conduct extensive liquid cooling testing, and we’re getting ready to deploy our first “small” liquid deployment of 4,000 GPUs",Planned,,11.848809792870606,,,,,,,4000.0,,18.597431897356124,7.916e+18,7.916e+18,3.9576e+18,1978800000000000000,5.6056,,706008277436.8489,188001966.1229629,,,,,,,700.0,80.0,0.0,0.0
160,Microsoft Azure ND H100 v5 VM,Existing,Confirmed,Yes,18.89850578553436,4000.0000000589,NVIDIA H100 SXM5 80GB,4000.0,United States of America,Microsoft,2023-03-13,Planned to scale up,Private,5.80944,190859527.0434332,,"Cloud,Azure",H100,"Today marks the general availability of our Azure ND H100 v5 Virtual Machine (VM) series, featuring the latest NVIDIA H100 Tensor Core GPUs and NVIDIA Quantum-2 InfiniBand networking... we are leveraging an AI optimized 4K GPU cluster and will be ramping to hundreds of thousands of the latest GPUs in the next year.",2023-03-13,,11.833297626692357,,,,,,,4000.0,7.0,18.597431897356124,7.916e+18,7.916e+18,3.9576e+18,1978800000000000000,5.80944,,681236057175.9069,190859527.0434332,,,,,Microsoft GPT-4 cluster,0.5074358974358958,700.0,80.0,0.0,0.0
161,Sweden 4k H100 Cluster,Existing,Likely,Yes,18.89850578553436,4000.0000000589,NVIDIA H100 SXM5 80GB,4000.0,Sweden,,2025-01-14,"Operational by 1/14/25 at the latest, but likely meaningfully earlier",Private,5.6056,150626230.5,Sweden,Cloud,H100,From a private correspondence,2025-01-14,From a private correspondence about GPU cluster availability,11.848809792870606,,,,,,,4000.0,46.0,18.597431897356124,7.916e+18,7.916e+18,3.9576e+18,1978800000000000000,5.6056,,706008277436.8489,150626230.5,,,,,xAI Colossus Memphis Phase 1,0.0400000000000003,700.0,80.0,0.0,0.0
162,Mistral Large Model Implied Cluster,Existing,Unlikely,Yes,18.89850578553436,4000.0000000589,NVIDIA H100 SXM5 80GB,4000.0,,,2023-11-26,"Taking H100 price as $2/hr, and assuming they trained for 3 months max, this implies that the cluster they used was >4k GPUs",Private,5.80944,132084652.72911642,,"Cloud,Mistral",,"""Mensch said his new model costs less than 20 million [Euros] to train""",2023-11-26,GPU count implied from stated training cost,11.833297626692357,,,,,,,4000.0,,18.597431897356124,7.916e+18,7.916e+18,3.9576e+18,1978800000000000000,5.80944,,681236057175.9069,132084652.72911642,,,,,,,700.0,80.0,0.0,0.0
163,Nebius Kansas City Phase 1,Existing,Likely,Yes,18.89850578553436,4000.0000000589,NVIDIA H200 SXM,4000.0,United States of America,Nebius AI,2025-04-15,"Current power is 5MW our of potential expansion to 40MW (which would host 35k GPUs), so extrapolating, that would put it at ~4k GPUs
They claimed that it was on track to go live in Q1 2025 in March 2025, implying that it likely came online soon after March",Private,5.0,142916741.8648148,"Kansas City, USA",Cloud,H200,"will house thousands of state-of-the-art NVIDIA GPUs, primarily NVIDIA Hopper GPUs in the initial phase, with the energy-efficient NVIDIA Blackwell platform expected to arrive in 2025. The colocation can be expanded from an initial 5 MW up to 40 MW, or about 35 thousand GPUs, at full potential capacity",2025-04,,11.898505785534358,,,,,,,4000.0,52.0,18.597475789870373,7.916e+18,7.916e+18,3.958e+18,1978000000000000000,5.6056,5.0,791600000000.0,142916741.8648148,,,,,xAI Colossus Memphis Phase 2,0.02,700.0,141.0,0.0,0.0
164,Anonymized Chinese System,Existing,Likely,Yes,18.90308998699194,4000.0,,10000.0,China,,2023-09-15,,Private,10.0,300000000.0,China,,,,,,11.60205999132796,,,,,,,10000.0,14.0,18.602059991327963,7.999999999999998e+18,7.999999999999998e+18,4e+18,1999999999999999700,10.0,,400000000000.0,300000000.0,,,,,Tesla 10k H100 Cluster,0.4,0.0,0.0,0.0,0.0
165,Anonymized Chinese System,Existing,Confirmed,Yes,18.845098040014257,4000.0,,,China,,2024-08-15,,Public/Private,,,China,,,,,,,,,,,,,20000.0,41.0,18.845098040014257,7e+18,,7e+18,,,,,,,,,,CoreWeave H200s,0.08,0.0,0.0,0.0,0.0
166,Anonymized Chinese System,Existing,Confirmed,Yes,18.90308998699194,4000.0,,,China,,2024-05-15,,Public/Private,,,China,,,,,,,,,,,,,,26.0,18.90308998699194,7.999999999999998e+18,,7.999999999999998e+18,,,,,,,,,,Meta GenAI 2024a,0.2,0.0,0.0,0.0,0.0
167,Anonymized Chinese System,Existing,Likely,Unclear,18.954242509439325,4000.0,,30000.000000000004,China,,2024-11-15,,Private,20.0,600000000.0,China,,,,,,11.30102999566398,,,,,,,30000.000000000004,,18.602059991327963,8.999999999999998e+18,8.999999999999998e+18,4e+18,1999999999999999700,20.0,,200000000000.0,600000000.0,,,,,,,0.0,0.0,0.0,0.0
168,Anonymized Chinese System,Planned,Likely,Yes,18.90308998699194,4000.0,,,China,,,,Public/Private,,,China,,,,,,,,,,,,,,,18.90308998699194,7.999999999999998e+18,,7.999999999999998e+18,,,,,,,,,,,,0.0,0.0,0.0,0.0
169,Gemini 1.0 Ultra training cluster A,Existing,Likely,Yes,18.89679068181229,3984.234461908105,Google TPU v4,28672.0,United States of America,Google,2023-08-20,Believed to be trained on two sets of 7 pods of 4096 TPUs,Private,20.226146304,259857295.64948127,,Google,TPUv4,"Gemini Ultra, the most compute-intensive model known to date, was trained across multiple data centers totaling 55,000 TPU v4s",2023-08-20,,11.59087753746646,,,,,,,28672.0,10.0,18.89679068181229,7.8848e+18,7.8848e+18,7.8848e+18,,20.226146304,,389832046178.79535,259857295.64948127,,,,,Microsoft GPT-4 cluster,0.5054358974358981,250.0,32.0,0.0,0.0
170,Gemini 1.0 Ultra training cluster B,Existing,Likely,Yes,18.89679068181229,3984.234461908105,Google TPU v4,28672.0,United States of America,Google,2023-08-20,Believed to be trained on two sets of 7 pods of 4096 TPUs,Private,20.226146304,259857295.64948127,,Google,TPUv4,"Gemini Ultra, the most compute-intensive model known to date, was trained across multiple data centers totaling 55,000 TPU v4s",2023-08-20,,11.59087753746646,,,True,Google Oklahoma TPU v4 Pods,,,28672.0,10.0,18.89679068181229,7.8848e+18,7.8848e+18,7.8848e+18,,20.226146304,,389832046178.79535,259857295.64948127,,,,,Microsoft GPT-4 cluster,0.5054358974358981,250.0,32.0,0.0,0.0
171,Vultr Chicago Cluster,Existing,Likely,Yes,18.89457633978582,3963.971702938611,AMD Instinct MI300X,3000.0,United States of America,Vultr,2024-12-11,"Not totally certain that the ""thousands"" of MI300X's are all in this data center, but I'm pretty sure. I'm also estimating ""thousands"" as 3k",Private,4.5864,81699126.74275017,"4513 Western Ave, Lisle, IL 60532",Cloud,MI300X,"With thousands of MI300X GPUs available, clusters of any size can be deployed",2024-12-11,Uncertain about exact chip count,11.932057806582945,,,,,,,3000.0,49.0,18.59352973534956,7.8447e+18,7.8447e+18,3.9222e+18,1961100000000000000,4.5864,,855180533751.9623,81699126.74275017,,,,,xAI Colossus Memphis Phase 1,0.0396397170288027,750.0,192.0,0.0,0.0
172,NFDG Andromeda Phase 2,Existing,Confirmed,Yes,18.88462319746458,3874.1586660499647,NVIDIA H100 SXM5 80GB,3632.0,United States of America,Nat Friedman and Daniel Gross,2024-07-15,,Private,5.808624640000001,146020983.3802864,"Ashburn, Virginia",Startups they invest in,"H100,A100","3,200 H100s on 400 nodes interlinked with 3.2Tbps infiniband
432 H100s on 54 nodes interlinked with 3.2Tbps infiniband
768 A100s for training and inference with 1.6Tbps infiniband",2024-07-15,Listed as available on their official website,11.819478740193112,NFDG Andromeda Phase 1,,,,NVIDIA A100 SXM4 40 GB,768.0,4400.0,36.0,18.583552052967537,7.66696e+18,7.66696e+18,3.8331168e+18,1916558400000000000,5.808624640000001,,659900929663.1017,146020983.3802864,,,,,Meta GenAI 2024a,0.1576399196774459,700.0,80.0,400.0,40.0
173,NVIDIA Coreweave MLPerf v3.0 Submission 2023,Existing,Confirmed,Yes,18.850813795196483,3584.000000052779,NVIDIA H100 SXM5 80GB,3584.0,United States of America,"NVIDIA,CoreWeave,Inflection AI",2023-06-01,"Inflection lent 3,500 H100 GPUs to Corweave (who appears to be the party that built that cluster) for the June MLPerf submission. Given that this is just slightly larger and operational just after, it appears very likely that this cluster is an extension of the MLPerf cluster (or the MLPerf cluster was just a subset of this cluster).
It's possible that both of these subsets of the Eos-DFW cluster, but there isn't evidence for this besides that Eos-DFW was submitted to MLPerf later that year",Private,5.205258239999999,129400759.97831686,,NVIDIA,H100,"The 10,752 H100 GPUs far surpassed the scaling in AI training in June, when NVIDIA used 3,584 Hopper GPUs.",2023-06-01,,11.833297626692357,,Inflection-2 training cluster,True,NVIDIA CoreWeave Eos-DFW Phase 1,,,3584.0,9.0,18.54973990701825,7.092736e+18,7.092736e+18,3.5460096e+18,1773004800000000000,5.205258239999999,,681236057175.9069,129400759.97831686,,,,,Microsoft GPT-4 cluster,0.4546625641025631,700.0,80.0,0.0,0.0
174,XTX Markets Cluster,Existing,Likely,Yes,18.79518458968242,3153.107630162636,NVIDIA A100,10000.0,,XTX Markets,2023-03-27,"Unclear how many of the GPUs are A100s vs V100s
The State of AI report indicates that they have 10k A100s, but it's unclear if they're just estimating this or have an actual source
Also, the earliest point in the waybackmaching that the State of AI report mentions this cluster is March 2023, which is where the date comes from",Private,14.523599999999998,409025143.8191224,,XTX Markets,"A100,V100,20,000 GPUs Maybe 10k A100, 10k V100?",Our dedicated research cluster contains a hundred thousand cores and twenty thousand A/V100 GPUs,2023-03-27,"Unclear how many of the GPUs are A100s vs V100s
The State of AI report indicates that they have 10k A100s, but it's unclear if they're just estimating this or have an actual source",11.478407157634615,,,,,NVIDIA V100,10000.0,20000.0,8.0,18.64048143697042,6.24e+18,6.24e+18,4.37e+18,1716700000000000000,14.523599999999998,,300889586603.8724,409025143.8191224,,,,,Microsoft GPT-4 cluster,0.3999999999999968,400.0,80.0,300.0,16.0
175,Novo Nordisk Gefion,Existing,Confirmed,Yes,18.77815125038364,3031.8342597717624,NVIDIA H100 SXM5 80GB,1528.0,Denmark,"Novo Nordisk Foundation,Danish Centre for AI Innovation,Export and Investment Fund of Denmark",2024-10-23,The Export and Investment Fund of Denmark (which is government-affiliated) owns 15% of the company created by Novo Nordisk that owns this supercomputer,Private,2.9307,99155664.2489824,Denmark,Public and private research; cloud,H100,"The supercomputer will feature 191 DGX H100 systems with a total of 1,528 Nvidia H100 Tensor Core GPUs and 382 Intel Xeon Platinum CPUs connected by Quantum 2 InfiniBand",2024-10-23,,11.71252389594499,,,,,,,1528.0,49.0,18.17949526026783,6e+18,6e+18,1.5118032e+18,755901600000000000,2.18027264,2.9307,515850547650.73193,58217750.86250277,98000000.0,99155664.2489824,"In terms of price, Novo Nordisk Foundation is putting up 600 million Danish krone (about 14 cents to the US dollar) and the Export and Investment Fund of Denmark (EIFO) us putting up another 100 million Danish krone.",,xAI Colossus Memphis Phase 1,0.0303183425972714,700.0,80.0,0.0,0.0
176,FPT AI Factory Vietnam,Planned,Likely,Yes,18.773567048926058,3000.0000000441755,NVIDIA H100 SXM5 80GB,3000.0,Vietnam,FPT Corporation,,"Estimating ""thousands"" as 3k here. They were supposed to receive their first shipment of 1k H100s in December 2024. The facility is said to be $200 million, so assuming an H100 price of ~30k, this means there would be a max of 6k H100s here",Private,4.2042,141001474.59222218,Vietnam,Cloud,"H100,H200","FPT's AI Factory, the first of its kind in Vietnam, is equipped with thousands of NVIDIA GPU H100 graphics chips and will be ready to provide services starting January 2025",Planned Q1 2025,,11.848809792870606,,,,,NVIDIA H200 SXM,,3000.0,,18.472493160747824,5.937e+18,5.937e+18,2.9682e+18,1484100000000000000,4.2042,,706008277436.8489,141001474.59222218,,,,,,,700.0,80.0,700.0,141.0
177,FPT AI Factory Japan,Planned,Likely,Yes,18.773567048926058,3000.0000000441755,NVIDIA H100 SXM5 80GB,3000.0,Japan,FPT Corporation,,"Same investment size as the Vietnam cluster, which said it would have ""thousands"" of GPUs. Estimating ""thousands"" as 3k here. They were supposed to receive their first shipment of 1k H100s in December 2024. The facility is said to be $200 million, so assuming an H100 price of ~30k, this means there would be a max of 6k H100s here",Private,4.2042,141001474.59222218,Japan,Cloud,"H100,H200","The center, like a similar $200 million Vietnam facility announced this year, will run on Nvidia Corp",Planned Q1 2025,,11.848809792870606,,,,,NVIDIA H200 SXM,,3000.0,,18.472493160747824,5.937e+18,5.937e+18,2.9682e+18,1484100000000000000,4.2042,,706008277436.8489,141001474.59222218,,,,,,,700.0,80.0,700.0,141.0
